Description,MRP,SP,Variant,,productname,imgurl,,
"Stylish Casual Enamel Design 

6-Way Casual Enamel Cart Bag Features 

Foam Padded Strap 
Dry Grip Bottom 
Brushed Nickel Towel Ring 
Matching Zippered Rainhood 
PU Material
 
Pockets

Large Apparel Pocket 
3 Zippered Accessory Pockets
 
Top-Cuff 

6-Way Club Dividers, Boxed Full-Length 
Full-Wrap, Padded Mesh Top-Cuff and Dividers
",,26900,Black ;,,Titleist Casual Enamel - Black,golfessentials.in/images/titleist/bags/casual_enamel_black/1.jpg,,
"Titleist Backpack 

The new Titleist TravelGear Backpack has been designed to handle your business and personal needs.
Featuring well-padded straps and travel-tested hardware that support the integrity of the Titleist brand.
Would suit anyone who is after a well made backpack while wanting to show the quality and name of the Titleist brand. 

Features:


Perfect for travel or business needs.
Made from Durable Woven polyester
Well Padded straps
",,3985,Black ;,,Titleist BackPack,golfessentials.in/images/titleist/bags/backpack/1.jpg,,
,,0,,, ,,,
"Plays Like a Pro

Mizuno's latest Tour Bag model is built to exceed the needs of their Tour caddies and players. The 9.5"""" Tour Bag includes a 6-way, easy access divider system, durable PU outer shell with multiple storage compartments, a large Mizuno pelican pocket, Mizuno balance handle, integrated Mizuno hydrosleeve, a molded contour shoulder strap and a lightweight Mizuno shower cap.

If you are a golfer that demands the best out of your Mizuno clubs, then you'll like the Mizuno Tour Staff Bag that will expertly match both your clubs and your game with its superior craftsmanship, styling and Mizuno engineering.

Features 

Mizuno angled balance handle that automatically balances the bag load when lifted
Mizuno lightweight, compact rainhood with QuikSnap attachment
Mizuno's easy access hydration pocket on both sides of bag
Large mouth pelican pocket, easy opening forward facing pocket
Weighs 12 pounds
Measures 34.5"""" H x 9.5"""" W
",,24990,White/Blue ;,,Mizuno Tour Staff Bag,golfessentials.in/images/mizuno/bags/tour_staff_bag/1.jpg,golfessentials.in/images/mizuno/bags/tour_staff_bag/2.jpg,
"Quality, Style &amp; Performance in this 14-Way Lightweight Stand Bag Design
Features 

EZ-Fit Dual Strap System 
Foam Padded Straps with Extra Padding at Stress Points 
Foam Padded, Comfort Mesh Covered Hip Pad 
Pen Holder  
Lower Assist Handle 
Dry Grip Bottom 
Lightweight Webbing Towel Ring 
Umbrella Velcro Loop Strap 
Matching Zippered Rainhood 

Pockets 

Full, Side Saddle Apparel Pocket 
Velour-Lined, Zippered Accessory Pocket 
Full, Side Saddle Ball Pocket 
Side Saddle Beverage Pocket 
Full-Size Ball Pocket on Spine 
Zippered Accessory Pocket on Spine
 
Top-Cuff 

Integrated Handle Built into Top-Cuff 
14-Way Club Dividers, Boxed Full-Length 
Full-Wrap, Padded Mesh Top-Cuff and Dividers

Stand 

Integrated into Top-Cuff 
Automatic Bag Stand with Broad Foot 
Tripod Rubber Feet on Legs 
Velcro Leg Lock Strap
",,18900,Black/White/Red ;,,Titleist 14 - Way Lightweight ,golfessentials.in/images/titleist/bags/way_lightweight/1.jpg,,
"Lightweight, Fully-Featured Stand Bag

Features 

EZ-Fit Dual Strap System
Foam Padded, Comfort Mesh Covered Hip Pad 
External Pen Holder 
Lower Assist Handle 
Dry Grip Bottom 
Umbrella Cord with Lower Grommet
Black Coated Lightweight Towel Ring 
Matching Zippered Rainhood 

Pockets 

Full, Side Saddle Apparel Pocket with Additional Zippered Stacked Pocket 
Full, Side Saddle Ball Pocket 
Waterproof Velour-Lined Accessory Pocket 
Beverage Pocket Sleeve 
Coal-Chute Ball Pocket 
Two, Additional Zippered Accessory Pockets

Top-Cuff 

Integrated Handle Built into Top-Cuff 
4-Way Club Dividers, Boxed Full-Length, 3-Ways 
Full-Wrap, Padded Mesh Top-Cuff and Dividers
 
Stand 

Stand Mechanism Integrated into Top-Cuff 
Automatic Bag Stand with Broad Foot 
Tripod Rubber Feet on Legs 
Velcro Leg Locking Strap
",,12900,Royal/White/Black ;,,Titleist Lightweight - Royal,golfessentials.in/images/titleist/bags/lightweight_royal/1.jpg,,
"Nike Departure Backpack II

Backpacks must have enough haul to meet all your essentials. The Nike Departure Backpack II provides optimal cushioning and comfort with the exclusive Max Air curved strap system. It features 10 functional pockets - including an organizer pocket, quick access magazine sleeve, dual side pockets, internal Apple iPad sleeve, separate padded laptop sleeve and laptop cord pocket. Plus, cresting is available for a unique and personalized design.
 
Durable woven nylon/poly material
External water-resistant fleece-lined valuables pocket
10 functional pockets
Nike Max Air curved strap system
Ventilated die cut air mesh back pad
Designed for easy cresting compatibility 
Size: 13.25"" W x 19.25"" H x 5.375"" D
",,6750,Black ;,,Nike Departure BackPack II,golfessentials.in/images/nike/bags/departure_backpack/1.jpg,golfessentials.in/images/nike/bags/departure_backpack/2.jpg,
"The Nike Xtreme Sport IV Golf Bag: Convenient carry all

The Nike Xtreme Sport IV Golf Bag is a course essential. With spacious storage for clubs and gear, this bag has a place for everything. Designed to stand up to wear and tear on the course, this bag is easy to carry and lightweight.

Benefits

8-way, 3 full-length divider system for optimal club storage
Multiple pockets with 6 zip closures for secure storage
Water-resistent, fleece-lined valuables pocket for secure storage
Full-length apparel pocket and mesh water bottle pocket for specialised storage
Revolving double strap system for customized carrying comfort
Ventilated mesh back pad for comfortable carrying

Additional Details

9-inch oval top
Integrated tee and range finder with GPS loop
Matching rain hood included for protection",,12900,Black/White/Gray  ;,,Nike Xtreme Sport IV - Black/White/Gray,golfessentials.in/images/nike/bags/xtreme_sport_iv_bwg/1.jpg,,
" Teflon coated, foam padded High Denier Nylon fabrics for a modern contemporary lookCobra C-10 Reverse Mens Golf Cart Bag Features:Comfortable Carrying strap with quick release buckleDouble Clothing pockets for maximum capacity, and Insulated Cool Pocket for drinks bottleOutside valuables pocket featuring water resistant zipper and velour pouch for mobile phone and walletTop and base grip handles",,9500,Black/Yellow ;,,Cobra C-10 Cart Bag,golfessentials.in/images/cobra/bags/c10/1.jpg,,
"SPACIOUS STORAGE, CONVENIENT CARRYING

The Nike Sport Cart II Golf Bag has multiple specialized pockets to keep the essentials close at hand. Made of durable, lightweight material, this bag offers on-course convenience and is built to last.

Benefits

Individual, 14 full-length divider system for convenience
Fleece-lined pocket to keep valuables secure and protected
Dual, full-length apparel pockets for versatile storage
Insulated cooler pockets and quick-access GPS pocket for convenience
Integrated tee holder, pen sleeve and glove patch to keep gear close at hand

Product Details

9.5"""" oval top
14-way, dual-sided top
Matching rain hood included
",,12900,Black/Sail-Anthracite ;,,Nike Sport Cart II - Black,golfessentials.in/images/nike/bags/sports_cart_II/1.jpg,,
"The Nike Xtreme Sport IV Golf Bag: Convenient carry all

The Nike Xtreme Sport IV Golf Bag is a course essential. With spacious storage for clubs and gear, this bag has a place for everything. Designed to stand up to wear and tear on the course, this bag is easy to carry and lightweight.

Benefits

8-way, 3 full-length divider system for optimal club storage
Multiple pockets with 6 zip closures for secure storage
Water-resistent, fleece-lined valuables pocket for secure storage
Full-length apparel pocket and mesh water bottle pocket for specialised storage
Revolving double strap system for customized carrying comfort
Ventilated mesh back pad for comfortable carrying

Additional Details

9-inch oval top
Integrated tee and range finder with GPS loop
Matching rain hood included for protection
",,12900,Blue/Orange ;,,Nike Xtreme Sport IV - Blue/Orange,golfessentials.in/images/nike/bags/xtreme_sport_iv_blue_orange/1.jpg,,
"Weighing approximately 5.5 pounds, the Traverse combines the simple handling of a carry bag with the generous storage of a cart bag. Molded cart handles with an integrated strap channel ease handling and keep the strap from blocking pocket access. The 14-way, mesh-covered top has individual dividers, plus an injection-molded putter well with soft-touch coating. Nine pockets including a zippered, insulated cooler pouch, two large apparel pockets, and a velour-lined valuables pocket.14-way, high-impact polypropylene top14 individual dividersInjection-molded putter wellMolded cart handles with integrated strap channelNine pockets, including ball and two apparel pocketsWeighs approximately 5.5 lbs.Insulated cooler pouchIntegrated trunk handleRain hood, hidden umbrella sleeveVelour-lined valuables pocketPremium YKK zippersDurable nylon fabricStiffer bag bottom",,14500,Black ;,,Ping Traverse Cart Bag,golfessentials.in/images/ping/bags/traverse_black/1.jpg,golfessentials.in/images/ping/bags/traverse_black/2.jpg,
"Weighing approximately 5.5 pounds, the Traverse combines the simple handling of a carry bag with the generous storage of a cart bag. Molded cart handles with an integrated strap channel ease handling and keep the strap from blocking pocket access. The 14-way, mesh-covered top has individual dividers, plus an injection-molded putter well with soft-touch coating. Nine pockets including a zippered, insulated cooler pouch, two large apparel pockets, and a velour-lined valuables pocket.14-way, high-impact polypropylene top14 individual dividersInjection-molded putter wellMolded cart handles with integrated strap channelNine pockets, including ball and two apparel pocketsWeighs approximately 5.5 lbs.Insulated cooler pouchIntegrated trunk handleRain hood, hidden umbrella sleeveVelour-lined valuables pocketPremium YKK zippersDurable nylon fabricStiffer bag bottom",,14500,Black/Gray ;,,Ping Traverse Cart Bag,golfessentials.in/images/ping/bags/traverse_black_gray/1.jpg,golfessentials.in/images/ping/bags/traverse_black_gray/2.jpg,golfessentials.in/images/ping/bags/traverse_black_gray/3.jpg
"The Cobra GT Stand Bag is made with the most innovative golf technologies. This bag is stylish and sleek, bringing a whole new look to the green.Molded, seven-way topPedal-activated, colored, and branded stand mechanismEVA molded side pocketsMolded, two-color handleEasy-access, neoprene ball pocketFully-padded and contoured, removable backpack harnessThree-dimensional sonic weld logo on side pocket",10300,9999,White/Yellow ;,,Cobra GT SX01170 Stand Bag ,golfessentials.in/images/cobra/bags/gt_stand/1.jpg,golfessentials.in/images/cobra/bags/gt_stand/2.jpg,golfessentials.in/images/cobra/bags/gt_stand/3.jpg
"6 Total pockets, including velour lined valuables pocket and accessory pocketsIntegrated Umbrella SleeveBlack Gunmetal Hardware and towel clipAnodized and Micro perforated Synthetic Leather",,16500,Black/White/Green ;,,TaylorMade RBZ Cart Bag,golfessentials.in/images/taylormade/bags/rbz_cart/1.jpg,golfessentials.in/images/taylormade/bags/rbz_cart/2.jpg,golfessentials.in/images/taylormade/bags/rbz_cart/3.jpg
"Weighing approximately 5.5 pounds, the Traverse combines the simple handling of a carry bag with the generous storage of a cart bag. Molded cart handles with an integrated strap channel ease handling and keep the strap from blocking pocket access. The 14-way, mesh-covered top has individual dividers, plus an injection-molded putter well with soft-touch coating. Nine pockets including a zippered, insulated cooler pouch, two large apparel pockets, and a velour-lined valuables pocket.14-way, high-impact polypropylene top14 individual dividersInjection-molded putter wellMolded cart handles with integrated strap channelNine pockets, including ball and two apparel pocketsWeighs approximately 5.5 lbs.Insulated cooler pouchIntegrated trunk handleRain hood, hidden umbrella sleeveVelour-lined valuables pocketPremium YKK zippersDurable nylon fabricStiffer bag bottom",,14500,White/Navy ;,,Ping Traverse Cart Bag,golfessentials.in/images/ping/bags/traverse_navy_white/1.jpg,golfessentials.in/images/ping/bags/traverse_navy_white/2.jpg,
Fully adjustable four piece shoulder strapFleece-lined valuables pocketVentilated (Airflow Channels) back supportWalking accessible water bottle holster,8500,8250,Black/Orange ;,,Srixon Stand Bag,golfessentials.in/images/srixon/bags/stand_black_orange/1.jpg,golfessentials.in/images/srixon/bags/stand_black_orange/2.jpg,golfessentials.in/images/srixon/bags/stand_black_orange/3.jpg
TAYLORMADE CB105V GOLF BAG is for golfers seeking modern Cart Bag functionality in a more traditional and sophisticated look and feel,,14900,Black/Silver ;,,TaylorMade CB105V Cart Bag,golfessentials.in/images/taylormade/bags/cb105v_black_silver/1.jpg,golfessentials.in/images/taylormade/bags/cb105v_black_silver/2.jpg,golfessentials.in/images/taylormade/bags/cb105v_black_silver/3.jpg
"Weighing approximately 5.5 pounds, the Traverse combines the simple handling of a carry bag with the generous storage of a cart bag. Molded cart handles with an integrated strap channel ease handling and keep the strap from blocking pocket access. The 14-way, mesh-covered top has individual dividers, plus an injection-molded putter well with soft-touch coating. Nine pockets including a zippered, insulated cooler pouch, two large apparel pockets, and a velour-lined valuables pocket.14-way, high-impact polypropylene top14 individual dividersInjection-molded putter wellMolded cart handles with integrated strap channelNine pockets, including ball and two apparel pocketsWeighs approximately 5.5 lbs.Insulated cooler pouchIntegrated trunk handleRain hood, hidden umbrella sleeveVelour-lined valuables pocketPremium YKK zippersDurable nylon fabricStiffer bag bottom",,14500,Black/White ;,,Ping Traverse Cart Bag,golfessentials.in/images/ping/bags/traverse_black_white/1.jpg,golfessentials.in/images/ping/bags/traverse_black_white/2.jpg,
"Patent-pending CG Comfort Suspension System reduces fatigue through shock-absorbing shoulder strap materials Easy fit into motorized golf carts Rubber gripping feet to prevent twisting Conveniently placed pockets for tees, pen and scorecard Insulated hydration sleeve, 9.5"" 6-way top with integrated top handle, Full-length club dividers, Elevated mesh hip pad with large airflow channels, Ergonomic rubber foot pads for 360-degree flexibility",9999,9900,White/Red/Gray ;,,Cleveland Light Weight Stand Bag,golfessentials.in/images/cleveland/bags/light_stand_white_red/1.jpg,golfessentials.in/images/cleveland/bags/light_stand_white_red/2.jpg,golfessentials.in/images/cleveland/bags/light_stand_white_red/3.jpg
"10"" 14-way top with full-length divider, 10 forward-facing pockets, Cart strap containment loop, Molded fabric side handles, Insulated cooler pocket, Integrated sleeves for pen and tee, Trunk handle, Shoulder strap stash containment loop, Rubber feet on base to prevent twisting, Umbrella containment system, Quick-snap rain hood, 7.8 lbs",,21000,Navy/White ;,,Cleveland 10 Inch Staff Bag 2012,golfessentials.in/images/cleveland/bags/tour_bag_2012/1.jpg,golfessentials.in/images/cleveland/bags/tour_bag_2012/2.jpg,golfessentials.in/images/cleveland/bags/tour_bag_2012/3.jpg
TAYLORMADE CB105V GOLF BAG is for golfers seeking modern Cart Bag functionality in a more traditional and sophisticated look and feel,,14900,Black/White/Yellow ;,,TaylorMade CB105V Cart Bag,golfessentials.in/images/taylormade/bags/cb105v_black_white_yellow/1.jpg,golfessentials.in/images/taylormade/bags/cb105v_black_white_yellow/2.jpg,golfessentials.in/images/taylormade/bags/cb105v_black_white_yellow/3.jpg
TAYLORMADE CB105V GOLF BAG is for golfers seeking modern Cart Bag functionality in a more traditional and sophisticated look and feel,,14900,Black/White/Silver ;,,TaylorMade CB105V Cart Bag,golfessentials.in/images/taylormade/bags/cb105v_black_white_silver/1.jpg,golfessentials.in/images/taylormade/bags/cb105v_black_white_silver/2.jpg,golfessentials.in/images/taylormade/bags/cb105v_black_white_silver/3.jpg
"9.5"" 6-way top2 Velour lined accessory pockets with waterproof zippers. Water bottle pocketUsed by Srixon Tour staff players",,19000,Black/White/Orange ;,,Srixon Staff Bag,golfessentials.in/images/srixon/bags/tour_bag/1.jpg,golfessentials.in/images/srixon/bags/tour_bag/2.jpg,golfessentials.in/images/srixon/bags/tour_bag/3.jpg
"Molded 6-way topMesh collar with full-length, lined club dividersIntegrated umbrella slotDual beverage pockets with mesh gussetsSingle padded, removable strapOversized side pockets with moulded Cobra patternCustomizable, removable belly pocketMultiple small item pockets including reverse tape, coated zippered pocketsRain hood includedMetal d-ring attachment for towelMolded base with pop color Snake logoThree dimensional sonic weld and embroidered logos",10900,10580,White/Black/Blue ;,,Cobra CT0104 Cart Bag,golfessentials.in/images/cobra/bags/CT0104_cart_blue/1.jpg,golfessentials.in/images/cobra/bags/CT0104_cart_blue/2.jpg,golfessentials.in/images/cobra/bags/CT0104_cart_blue/3.jpg
Descriotion Unavailable,10500,10200,White/Yellow ;,,Cobra CB961 Cart Bag,golfessentials.in/images/cobra/bags/CB961_cart/1.jpg,golfessentials.in/images/cobra/bags/CB961_cart/2.jpg,golfessentials.in/images/cobra/bags/CB961_cart/3.jpg
"CG Comfort Suspension System reduces fatigue through shock-absorbing shoulder strap materials Easy fit into motorized golf carts Rubber gripping feet to prevent twisting Conveniently placed pockets for tees, pen and scorecard Insulated hydration sleeve, 9.5"" 6-way top with integrated top handle, Full-length club dividers, Elevated mesh hip pad with large airflow channels, Ergonomic rubber foot pads for 360-degree flexibility",9999,9900,White/Blue ;,,Cleveland Light Weight Stand Bag,golfessentials.in/images/cleveland/bags/stand_white_blue/1.jpg,golfessentials.in/images/cleveland/bags/stand_white_blue/2.jpg,golfessentials.in/images/cleveland/bags/stand_white_blue/3.jpg
"CG Comfort Suspension System reduces fatigue through shock-absorbing shoulder strap materials Easy fit into motorized golf carts Rubber gripping feet to prevent twisting Conveniently placed pockets for tees, pen and scorecard Insulated hydration sleeve, 9.5"" 6-way top with integrated top handle, Full-length club dividers, Elevated mesh hip pad with large airflow channels, Ergonomic rubber foot pads for 360-degree flexibility",9999,9900,White/Green ;,,Cleveland Light Weight Stand Bag,golfessentials.in/images/cleveland/bags/stand_white_green/1.jpg,golfessentials.in/images/cleveland/bags/stand_white_green/2.jpg,golfessentials.in/images/cleveland/bags/stand_white_green/3.jpg
"Molded 6-way topMesh collar with full-length, lined club dividersIntegrated umbrella slotDual beverage pockets with mesh gussetsSingle padded, removable strapOversized side pockets with moulded Cobra patternCustomizable, removable belly pocketMultiple small item pockets including reverse tape, coated zippered pocketsRain hood includedMetal d-ring attachment for towelMolded base with pop color Snake logoThree dimensional sonic weld and embroidered logos",10900,10580,White/Black/Yellow ;,,Cobra CT0104 Cart Bag,golfessentials.in/images/cobra/bags/CT0104_cart_yellow/1.jpg,golfessentials.in/images/cobra/bags/CT0104_cart_yellow/2.jpg,golfessentials.in/images/cobra/bags/CT0104_cart_yellow/3.jpg
"Molded 6-way topMesh collar with full-length, lined club dividersIntegrated umbrella slotDual beverage pockets with mesh gussetsSingle padded, removable strapOversized side pockets with molded Amp Cell patternCustomizable, removable belly pocketMultiple small item pockets including reverse tape, coated zippered pocketsRain hood includedMetal d-ring attachment for towelRemovable belly pocket for customizationMolded base with pop color Snake logoThree dimensional sonic weld and embroidered logos",29800,26800,Gray ;,,Cobra Staff Bag,golfessentials.in/images/cobra/bags/staff_gray/1.jpg,golfessentials.in/images/cobra/bags/staff_gray/2.jpg,golfessentials.in/images/cobra/bags/staff_gray/3.jpg
"10 Inch high14.6 Inch wideApollo stand bag has zip-off ball pocket8-Inch by 10-inch 5-way stadium top7 Total pockets featuring velour-lined valuables pocket, insulated cooler sleeveRemovable ball pocket for customizationGraphics inspired by iconic R1 metal wood design",,11900,White/Gray/Orange ;,,TaylorMade Apollo Stand Bag,golfessentials.in/images/taylormade/bags/apollo_stand/1.jpg,golfessentials.in/images/taylormade/bags/apollo_stand/2.jpg,golfessentials.in/images/taylormade/bags/apollo_stand/3.jpg
Padded shell for club protectionLockable zippersDurable nylon constructionInternal bag strapsDurable wheelsID slotWeight:9 lbsLength:12.75 inchesWidth:9.75 inchesHeight:50 inches,10000,9800,Black ;,,Callaway Chev Travel Bag,golfessentials.in/images/callaway/bags/chev_travel_bag/1.jpg,golfessentials.in/images/callaway/bags/chev_travel_bag/2.jpg,
"3-point double strap7 pockets, including a velour-lined valuables pocket and a mesh water bottle pocketRedesigned lightweight molded base maintains full contact with ground when stand is activatedFoam hip pad for better ventilation and comfortBall alignment zipper pull and elastic towel cordScorecard and pen holderHook &amp; loop glove patchRain hood and umbrella cord",,9500,Red ; Blue ; Gray ;,,Callaway Euro Chev Stand Bag,golfessentials.in/images/callaway/bags/euro_chev_stand/1.jpg,,
"9.5 Inch Graphite Friendly Top, with Moulded Grab Handle, 14-Way Divider system with 3 Full Length Dividers9 Pockets -Twin Full Length Apparel Pockets, Soft Lined Valuables Pocket with Waterproof Zipper, Scorecard Pocket, Wet Pocket, Upper Dry Pocket with Waterproof Zipper. Insulated Drinks Pocket, Ball Pocket and Accessory Pocket. Carry Handle with Base Grab Handle and Trolley Friendly BaseWeight - 3.63 kgDurable 95% Nylon &amp; 5% PU Material",12990,12490,White/Black ;,,Callaway 2013 Euro Chev Luxury Cart Bag,golfessentials.in/images/callaway/bags/2013_euro_chev/1.jpg,golfessentials.in/images/callaway/bags/2013_euro_chev/2.jpg,golfessentials.in/images/callaway/bags/2013_euro_chev/3.jpg
"Black, white, and dark greyLightweight durable nylon constructionFunctional pockets to store valuables5 x 7 x 5 inches ",1750,1695,Black/Grey ;,,Nike Sport Organiser Pouch Bag,golfessentials.in/images/nike/bags/organiser/1.jpg,,
"The TaylorMade R1 Golf Cart Bag offers you a 14-way stadium top design (27cm x 23cm) with full length dividers to organise and protect your valued clubs.For added customisation, this bag also features a removable ball pocket. Because of its design, all features are immediately accessible.Integrated putter tubeTPR Anti-slip cart strap padCrush-resistant constructionUmbrella sleeve",,14900,White/Gray/Orange ;,,TaylorMade Apollo Cart Bag ,golfessentials.in/images/taylormade/bags/apollo_cart/1.jpg,golfessentials.in/images/taylormade/bags/apollo_cart/2.jpg,golfessentials.in/images/taylormade/bags/apollo_cart/3.jpg
"
New Nike Sport II Shoe Tote
Lightweight and durable construction
Mesh ventilation panel
Designed for easy cresting compatibility
",,1490,"14.6""W x 18""H x 2.4""D Black / Grey ;",,Nike Sport II Shoe Tote,golfessentials.in/images/nike/bags/shoe/1.jpg,,
"Sorry,  is currently unavailable.",3250,3185,Black ;,,Nike Sport Duffle Bag,golfessentials.in/images/nike/bags/duffel/1.jpg,golfessentials.in/images/nike/bags/duffel/2.jpg,
"Titleist Premium Staff Bag

The Choice of Leading Professionals Exciting new contemporary design with proven performance on the Worldwide Professional Tours, this premium staff bag will continue to cater to the needs of the serious player. All the premium features and benefits demanded in this flagship, billboard bag make it the choice of leading professionals around the globe. 
 
Staff Bag Features   
6-Way Top Divider: Available in 9.5"" Top-Cuff 
Adjustable 3-Point Sling Suspension with Comfortable Foam- Padded Strap
Lower Assist Handle 
Polypropylene Zippered Rainhood
Integrated Umbrella Sleeve
Zip-Off Belly Panel for Personal Customization

Pockets 
Multiple Pockets Including a Velour Lined Valuables Pocket and Dual Accessory Pockets Behind the Billboard Panels 
Zippered Velour-Lined Accessory 
Pocket 
Versatile Large Entry Apparel Pocket. Interior Also Includes Added Organizational Features 
Zip-Off Apparel Pocket Panel for Ease in Customization
The 9.5"" Top-Cuff Staff Bag Includes 1 Ball Pocket
Hidden Water Bottle Pocket


Top-Cuff
6-Way Club Dividers
Round Top with 6-Way Mesh Padded Top-Cuff and 3-Way Full-Length Dividers
Step-Down Design Provides Easy Removal and Replacement of Clubs and Increases Club Visibility
",,22900,Black ;,,Titleist Premium Staff Bag,golfessentials.in/images/titleist/bags/premium_staff/1.jpg,golfessentials.in/images/titleist/bags/premium_staff/2.jpg,
"Ultra-premium reflective materialUsed by Nike Tour Professionals10.25 -inch round top6-way top divider system provides exceptional club management9 strategically placed pockets (5 zippered + 2 magnet), including fleece-lined valuables, quick access magnetic pocket, dual insulated water bottle sleeves and oversized apparel pocket allow for efficient gear organizationVersatile cabinet door storage compartment accommodates all equipment needsNike rubberized custom moulded handle provides easy loading and transportExtremely durable component hardwareMatching rain hood includedZip-off blank panel for personal customization",,25000,Black ;,,Nike Nike VRS Staff Bag,golfessentials.in/images/nike/bags/vrs_staff/1.jpg,golfessentials.in/images/nike/bags/vrs_staff/2.jpg,golfessentials.in/images/nike/bags/vrs_staff/3.jpg
