SKU,Description,SP,MRP,productname,Brand,Size,Stock,imgurl,imgurl,imgurl,imgurl
363057-B205N-0190,"
							The Asics Gel Progressive Indoor shoe delivers the premium level of features making it quick, light, grippy but well supported for indoor courts. A shoe packed full of technology with great levels of stability, comfort and shock absorption.

Air Mesh, synthetic leather and Personal Heel Fit in the upper provide excellent comfort and breathability.

Biomorphic Fit technology allows the upper of the shoe to move in harmony with the foot, giving more comfort while in motion. This fit means the shoe material does not bunch, reducing the risk of blisters or irritation.

Utilises the Space Trusstic, an advanced system that creates a pocket between the Trusstic System device and the midsole, allowing for greater midsole deformation and more efficient foot function.

Forefoot and rearfoot GEL reduces the loading forces as the foot moves into propulsion, improving performance and minimising the risk of injury.

There is a vented sole and midsole which minimises weight and maximises breathability. There is also Forefoot Guidance Line, a vertical flex groove in the forefoot of the sole which encourages a more efficient running style.

With a wet grip rubber outsole designed from a special blend of components they deliver excellent traction even on a wet surface.MaterialRubber Synthetic 						",8773.83,10440.8577,ASICS Gel-Beyond Men's Indoor Court Shoe,ASICS,UK6;UK7;UK9.5;UK10.5;UK11,,http://products.activinstinct.com/y2013/m06/363057/39037802-n.jpg,http://assets.activinstinct.com/images/language/en/btn-click-to-zoom.gif,,
166879-SX200,,8773.83,10440.8577,APOLLO XL 200m Squash String Reel,APOLLO,,,http://products.activinstinct.com/y2010/m03/166879/58266912-n.jpg,http://assets.activinstinct.com/images/language/en/btn-click-to-zoom.gif,,
210566-8P353077,"
							The Prince Renegade Indoor Shoe is a renegade by name and by nature breaking with traditional squash shoe design with the use of LightSpeed Technology. A low profile silhouette keeps your centre of gravity low for killer balance and uncompromising stability. The shoe's propulsion plate redirects energy into the forefoot for speed that'll blow your opponents away. All this results in unmatched agility and response.

Features a lightweight synthetic leather and mesh upper, Duraskin II high abrasion toe guard for protection and a TPU arch bridge for torsional stability.

The visible Shock Eraser Pro insert for increased heel protection and gum rubber outsole will provide comfort and grip to keep you playing your hardest no matter how long the game.MaterialNylon Syn Leather 						",8716.5,10372.635,PRINCE Men's Renegade Indoor Shoes,PRINCE,UK6;UK6.5;UK7;UK7.5,,http://products.activinstinct.com/y2011/m01/210566/94029581-n.jpg,http://assets.activinstinct.com/images/language/en/btn-click-to-zoom.gif,,
387685-8P715084,"
							Part of the NFS series which has been designed to provide exceptional traction on indoor surfaces for enhanced Club. The shoe features Prince Natural Foot Shape design to bring a new level of comfort and fit to performance indoor footwear. Moulded lateral and medial stabilisers provide a stable base for your game by strategically cradling the foot.

Prince ShockEraser2 heel cushion and polyurethane forefoot cushion optimise shock dispersion and provide added cushioning for maximum comfort.MaterialMesh Rubber Synthetic 						",7545.33,8978.9427,PRINCE NFS II Indoor Court Shoe,PRINCE,UK6;UK6.5;UK7;UK7.5;UK8;UK8.5;UK9.5;UK11,,http://products.activinstinct.com/y2013/m10/387685/95599769-n.jpg,http://assets.activinstinct.com/images/language/en/btn-click-to-zoom.gif,,
387670-8P354087,"
							Part of the NFS series which has been designed to provide exceptional traction on indoor surfaces for enhanced Club. The shoe features Prince Natural Foot Shape design to bring a new level of comfort and fit to performance indoor footwear.

The Prince NFS Rally squash shoes are suitable for indoor court surfaces and have been designed to provide maximum comfort and stability. The lightweight synthetic upper has breathable mesh panels to ensure good ventilation, while the EVA midsole and removable moulded EVA sockliner provide lightweight shock absorption and reduce fatigue. The gum rubber outsole ensures good traction on indoor surfaces.MaterialMesh Rubber Synthetic 						",8071.83,9605.4777,PRINCE NFS Rally Indoor Court Shoe,PRINCE,UK7;UK10;UK10.5,,http://products.activinstinct.com/y2013/m10/387670/97276777-n.jpg,http://assets.activinstinct.com/images/language/en/btn-click-to-zoom.gif,,
16513-8P931900,"
							The Prince NFS IV indoor shoes feature the distinctive Prince styling with anatomically constructed upper to keep your feet protected and comfortable from the extreme demands of a game where serious pressure is placed on your joints.

Built on the Natural Foot Shape last, the lightweight NFS Indoor shoes provide instant, no break-in comfort and support for players seeking exceptional stability and cushioning. The NFS last is famous for the generous fit, particularly in the forefoot.

Breathable mesh areas and soft synthetic upper provide excellent rigidity to keep your foot planted inside the shoe and restrict movement whilst keeping them cool.

The EVA midsole, anatomical and removable EVA sock liner, non-marking rubber sole and special lacing system take this further by working together to provide excellent shock absorption and keeping your feet moving quickly so you get to your next shot with ease.MaterialNylon Syn Leather 						",8073,9606.87,PRINCE NFS Indoor IV Men's Shoes ,PRINCE,UK7;UK7.5;UK8;UK9.5;UK10.5,,http://products.activinstinct.com/y2008/m12/16513/16513-n.jpg,http://assets.activinstinct.com/images/language/en/btn-click-to-zoom.gif,,
373925-Q35129,"
							Part of the Stabil family that has produced balanced and high performing court shoes for a number of years, this indoor shoe is lighter, stronger and more flexible than it has ever been. With an excellent fit and brilliant strength it has top on-court performance.

There is a Tech-Net TPU grid for abrasion resistance, stabilisation and protection of the forefoot. The gum rubber compound ensures excellent grip on all indoor surfaces.

The Torsion System provides midfoot integrity and motion guidance, while highly responsive Adiprene EVA maintains forefoot propulsion to accelerate your game.MaterialRubber Synthetic Material 						",8599.5,10233.405,ADIDAS Court Stabil 10.1 Unisex Indoor Shoes,ADIDAS,UK7;UK8.5;UK10.5,,http://products.activinstinct.com/y2013/m07/373925/43711748-n.jpg,http://assets.activinstinct.com/images/language/en/btn-click-to-zoom.gif,,
288466-7Q342280,"
							This premium squash string has a pre-stretched multifilament core for extra control. Its power band outer wraps add responsiveness and feel.


Rebel?s key qualities are similar to those of natural gut ? power, comfort and feel.
Rebel also has good durability.
A multifilament string with strong all-round qualities. A softer elasticity for more attacking power and resilience.
Control is enhanced through its low trampoline effect.

Gauge: 1.20mm						",18601.83,22136.1777,PRINCE Rebel Squash Reel Optic Yellow (200m),PRINCE,,,http://products.activinstinct.com/y2012/m05/288466/43150339-n.jpg,http://assets.activinstinct.com/images/language/en/btn-click-to-zoom.gif,,
375479-Q97859,"
							The adidas BT Feather Badminton Shoe is designed to provide a combination of solid support and agile ability. This shoe pairs a flexible and powerful forefoot for high speed agility in all directions. The open mesh and a ventilation grip provide enhanced breathability whilst a badminton specific construction delivers comfort and stability in all playing conditions. The non-marking rubber compound allows for unmatched grip on all badminton surfaces.

Adiprene insert for ideal cushioning during badminton specific movements.

Adiprene+ insert for a powerful acceleration during all badminton specific movements.

Air Mesh for maximum ventilation.

Adituff abrasion resistant material placed at the medial forefoot to combat abrasion zones.

Rearfoot Stabiliser construction for stability during badminton specific multidirectional movements.

Torsion System stabilises your midfoot in badminton specific movements and enhances control, support and fit.MaterialRubber Synthetic Material 						",8541,10163.79,ADIDAS BT Feather Men's Badminton Shoe,ADIDAS,UK6;UK6.5;UK7;UK7.5;UK8;UK8.5;UK9;UK9.5;UK10;UK10.5;UK11;UK11.5;UK12,,http://products.activinstinct.com/y2013/m08/375479/59263569-n.jpg,http://assets.activinstinct.com/images/language/en/btn-click-to-zoom.gif,,
428536-296083,"
							A superb graphite composite racket for the club player.

Features:

Suitable for the club player
A superb graphite composite racket
Made from Graphite composite
Mega Power Zone
Double String System
Anti-Vibration System
Balance- Mid
String- Unsquashable 500 Silver string						",8422.83,10023.1677,UNSQUASHABLE DSP 700 Squash Racket,UNSQUASHABLE,,,http://products.activinstinct.com/y2014/m05/428536/38161946-n.jpg,http://assets.activinstinct.com/images/language/en/btn-click-to-zoom.gif,,
375507-F32933,"
							The adidas BT Feather Team Badminton Shoe has the right amount of stability in the rounded heel and launch in the forefoot that helps you cover the court from any direction with speed and precision. A badminton specific construction delivers comfort and stability during all playing conditions while the non-marking rubber compound allows for the best grip on all badminton surfaces.

Adiprene insert for ideal cushioning during badminton specific movements.

Adiprene+ insert for a powerful acceleration during all badminton specific movements.

Adituff abrasion resistant material placed at the medial forefoot to combat abrasion zones.

Rearfoot Stabiliser construction for stability during badminton specific multidirectional movements.

Torsion System stabilises your midfoot in badminton specific movements and enhances control, support and fit.MaterialRubber Synthetic Material 						",8305.83,9883.9377,ADIDAS BT Feather Team Men's Badminton Shoe,ADIDAS,UK6;UK6.5;UK7;UK7.5;UK8;UK8.5;UK9;UK9.5;UK10;UK10.5;UK11;UK11.5;UK12,,http://products.activinstinct.com/y2013/m08/375507/83367696-n.jpg,http://assets.activinstinct.com/images/language/en/btn-click-to-zoom.gif,,
288464-7Q335000,"
							Explosive power on contact and exceptional durability in one great string.

Spring loaded polyester Powerfoil releases explosive energy on impact for greater power while providing a broadband wear barrier for increased durability.

Gauge: 1.25mm						",13453.83,16010.0577,PRINCE Lightning XX Indoor Squash Reel Clear/Silver (200m),PRINCE,,,http://products.activinstinct.com/y2012/m05/288464/47783371-n.jpg,http://assets.activinstinct.com/images/language/en/btn-click-to-zoom.gif,,
328642-817165,"
							The new biomimetic Tour luggage range has been designed with serious tennis players in mind, constructed with premium, durable materials for even the most demanding of players on the tour.


Versatile large holdall capable of carrying a large amount of sports equipment
Durable 1680 Ballistic polyester and 420D polyester construction
Two end pockets, one of which has large shoe/wet pocket
Internal soft wall pockets
Side panel pocket with internal phone/iPod pocket, key lip and valuables pocket
Adjustable padded handles for over the shoulder or hand carryingMaterialPolyester 						",9124.83,10858.5477,DUNLOP Biomimetic Tour Large Holdall,DUNLOP,,,http://products.activinstinct.com/y2012/m12/328642/65698726-n.jpg,http://assets.activinstinct.com/images/language/en/btn-click-to-zoom.gif,,
401590-D67038,"
							Light, strong and flexible, these women's handball shoes help you play to win. The shoes feature a breezy air mesh upper with power and support from the trio of ADIPRENE+ forefoot, the TORSION midfoot and the high-impact ADIPRENE heel cushioning.


Air mesh upper for maximum ventilation
ADITUFF for best abrasion resistance in the toe area
ADIPRENE+ in the forefoot maintains propulsion and efficiency
TORSION SYSTEM for midfoot integrity; EVA sockliner for comfort and support
ADIPRENE under the heel for superior cushioning at impact
NON MARKING gum rubber outsole for excellent grip on all indoor surfacesMaterialRubber Synthetic Material 						",8073,9606.87,ADIDAS Court Stabil 10.1 Ladies Indoor Shoes,ADIDAS,UK5.5;UK6;UK6.5,,http://products.activinstinct.com/y2014/m01/401590/99909091-n.jpg,http://assets.activinstinct.com/images/language/en/btn-click-to-zoom.gif,,
198013-6P737021,"
							The Prince Tour Team Pro Duffle is a premium tour quality bag filled with features to make your play and travel fit seamlessly together whilst protecting your equipment so you can enjoy your tennis.

Features footwear pockets, accessory pocket, clip system and a carry handle for easy carry.

28""L x 13""H x 14""WMaterialPolyester 						",8656.83,10301.6277,PRINCE Tour Team Pro Duffle,PRINCE,,,http://products.activinstinct.com/y2010/m11/198013/34093277-n.jpg,http://assets.activinstinct.com/images/language/en/btn-click-to-zoom.gif,,
420072-F82008,"
							This is how you play it cool and pretty for the win. Made from innovative climalite knit fabric with strategically placed climacool vents, this ladies tennis dress sweeps heat and sweat out of your game and breezes in cool, dry determination with every move and swing. And in celebration of Brazil 2014, it flashes hot streaks of Bahia-inspired bands worked into the mesh back design. Comes with bra and shorts, plus a pack of three Bahia bands for added style points.


83 cm back length (size 36)
Ventilated climacool keeps you cool and dry
Asymmetric neckline; Contrast binding and right shoulder strap
Racer back; Mesh back with colourful elastic tape
Separate bra and tights included; Roland Garros badge on left shoulder; Slim fit
100% polyester interlockMaterialPolyester Fabric 100%						",8071.83,9605.4777,ADIDAS Roland Garros Ladies Dress,ADIDAS,10;12,,http://products.activinstinct.com/y2014/m03/420072/14744049-n.jpg,http://assets.activinstinct.com/images/language/en/btn-click-to-zoom.gif,,
375661-09KV39109,"
							A shoe for ultimate multi- court performance. This shoe features Wave technology, and specifically, a Parallel Wave plate. Parallel Wave technology uniformly disperses shock throughout the sole, providing excellent cushioning and enhanced stability.

AIRmesh provides the utmost in breathability and comfort in the upper, while a high-grade removable insock ensures premium comfort, cushioning and durability.

CMEVA midsole provides cushioning and support. Dynamotion Groove outsole enhances stability for the foot during lateral movements on court and increases flexibility. Intercool system to help regulate humidity and temperature in the shoe to maintain comfort.MaterialSynthetic Leather Rubber 						",8071.83,9605.4777,MIZUNO Wave Rally 4 Men's Indoor Shoe,MIZUNO,UK4;UK4.5;UK5;UK5.5;UK6;UK6.5;UK7;UK7.5;UK8;UK8.5;UK9.5;UK10;UK10.5;UK11;UK12,,http://products.activinstinct.com/y2013/m08/375661/95691365-n.jpg,http://assets.activinstinct.com/images/language/en/btn-click-to-zoom.gif,,
375681-09KV39023,"
							A shoe for ultimate multi- court performance. This shoe features Wave technology, and specifically, a Parallel Wave plate. Parallel Wave technology uniformly disperses shock throughout the sole, providing excellent cushioning and enhanced stability.

AIRmesh provides the utmost in breathability and comfort in the upper, while a high-grade removable insock ensures premium comfort, cushioning and durability.

CMEVA midsole provides cushioning and support. Dynamotion Groove outsole enhances stability for the foot during lateral movements on court and increases flexibility. Intercool system to help regulate humidity and temperature in the shoe to maintain comfort.MaterialSynthetic Leather Rubber 						",8071.83,9605.4777,MIZUNO Wave Rally 4 Ladies Indoor Shoe,MIZUNO,UK5.5;UK7;UK7.5;UK8,,http://products.activinstinct.com/y2013/m08/375681/93597269-n.jpg,http://assets.activinstinct.com/images/language/en/btn-click-to-zoom.gif,,
358274-WRT905300,"
							Part of the 2013 Carbon Series, the CS Command is a great all round racket for the social to comp player.

Specification:

Headsize: 471cm2
Weight (unstrung): 150g
Balance (unstrung): 33.5cm
String pattern: 14 x 18						",8071.83,9605.4777,WILSON CS Command Squash Racket,WILSON,,,http://products.activinstinct.com/y2013/m05/358274/62942828-n.jpg,http://assets.activinstinct.com/images/language/en/btn-click-to-zoom.gif,,
405739-WRZ833492,"
							Designed for the everyday player. This bag features a main compartment, with additional compartments for shoes, accessories and valuables. Perfect for taking kit while travelling.


Side racket compartment
One large main compartment for clothing or equipment
Built in shoe tunnel ideal to keep shoes and dirty clothes separate from other equipment
Front small accessory pocket
Small side accessory pocket
Padded shoulder strap with clips that allow easy removal of the straps
Oversized two piece centre handle for easy pick up and carry
PVC free

Dimensions: 77 x 31 x 36cm						",8071.83,9605.4777,WILSON Federer Duffle Bag,WILSON,,,http://products.activinstinct.com/y2014/m01/405739/34074257-n.jpg,http://assets.activinstinct.com/images/language/en/btn-click-to-zoom.gif,,
374652-Q21634,"
							The Adidas Court Stabil 10.1 W Indoor shoes provide both optimal motion control through a special rubber compound for excellent grip on all indoor surfaces.

Features:

Provides for optimal motion control.
AdiPRENE under the heel for comfort and cushioning.
Great abrasion resistance in the toe area for optimum comfort and stability.
Special rubber compound for excellent grip on all indoor surfaces.
TPU mesh for abrasion resistance, stabilization and protection of the forefoot.MaterialMesh Rubber Synthetic 						",7839,9328.41,ADIDAS Court Stabil 10.1 W Men's Indoor Court Shoes,ADIDAS,UK7;UK9.5;UK10;UK11,,http://products.activinstinct.com/y2013/m07/374652/75210295-n.jpg,http://assets.activinstinct.com/images/language/en/btn-click-to-zoom.gif,,
393060-KZ991,"
							Made from new Superlight polyester material, which is 40% lighter than previous models, this does not sacrifice strength or durability. All the new Superlight bags have soft foam inner linings and carry straps to increase support and comfort when carrying.

Features:

2 Racket Pockets hold a minimum of 8 Rackets
2 Central Zipped Kit Pocket
Zipped Side Pocket For Accessories / Valuables
Backpack Carrying System for easy carrying
75cm x 40cm x 30cm
75 Litre Capacity						",7896.33,9396.6327,KARAKAL RB-75 Superlight Racket Bag,KARAKAL,,,http://products.activinstinct.com/y2013/m11/393060/36256735-n.jpg,http://assets.activinstinct.com/images/language/en/btn-click-to-zoom.gif,,
317215-C002088-51,"
							As good as it gets. The new V-Lite Infinity Flare is worn by double world champion and world number one Nick Matthew, who also helped with its development. Packed full of game changing technologies, the shoe is lightweight, fast, cushioned and supportive. One of the best squash shoes on the market.

V-Lite is a revolutionary vertical build concept that strips away as much weight as possible without sacrificing performance or durability. No one specific technology can be credited for the light weight of this collection, but rather the creative combination of innovative materials and construction.

The biomechanical pressure map is translated into two eight-density midsole configurations, which correspond with the various pressure zones.

The Ortholite footbed is made with open-cell foam, allowing air to circulate around the foot, keeping your foot cooler inside the shoe.MaterialMesh Rubber Synthetic 						",7603.83,9048.5577,HI-TEC Ladies Infinity Flare Squash Shoe,HI-TEC,UK4;UK4.5;UK5;UK5.5;UK6;UK6.5;UK7;UK8,,http://products.activinstinct.com/y2012/m10/317215/90109180-n.jpg,http://assets.activinstinct.com/images/language/en/btn-click-to-zoom.gif,,
375465-F32928,"
							The adidas BT Feather Badminton Shoe is designed to provide a combination of solid support and agile ability. This shoe pairs a flexible and powerful forefoot for high speed agility in all directions. The open mesh and a ventilation grip provide enhanced breathability whilst a badminton specific construction delivers comfort and stability in all playing conditions. The non-marking rubber compound allows for unmatched grip on all badminton surfaces.

Adiprene insert for ideal cushioning during badminton specific movements.

Adiprene+ insert for a powerful acceleration during all badminton specific movements.

Air Mesh for maximum ventilation.

Adituff abrasion resistant material placed at the medial forefoot to combat abrasion zones.

Rearfoot Stabiliser construction for stability during badminton specific multidirectional movements.

Torsion System stabilises your midfoot in badminton specific movements and enhances control, support and fit.MaterialRubber Synthetic Material 						",7603.83,9048.5577,ADIDAS BT Feather Men's Indoor Shoe,ADIDAS,UK6;UK6.5;UK7;UK7.5;UK8;UK8.5;UK9;UK9.5;UK10;UK10.5;UK11;UK11.5;UK12,,http://products.activinstinct.com/y2013/m08/375465/48640516-n.jpg,http://assets.activinstinct.com/images/language/en/btn-click-to-zoom.gif,,
383527-ATB860T,"
							This Ashaway Triple thermo bag consists of three zipped, large main compartments and a side pocket. Of these compartments, the main one is equipped with thermal foil lining, which protects rackets and strings from the effects of extreme changes in temperature, thus ensuring greater performance and durability for the rackets. The bag is suitable for up to nine rackets and kit. It features twin carry straps and handles for easy and comfortable transportation.MaterialRipstop 						",7603.83,9048.5577,ASHAWAY Triple ATB860T Bag,ASHAWAY,,,http://products.activinstinct.com/y2013/m09/383527/38399817-n.jpg,http://assets.activinstinct.com/images/language/en/btn-click-to-zoom.gif,,
191778--,,7603.83,9048.5577,BLACK KNIGHT Stealth Squash Racket,BLACK KNIGHT,,,http://products.activinstinct.com/y2010/m10/191778/78606839-n.jpg,http://assets.activinstinct.com/images/language/en/btn-click-to-zoom.gif,,
315580-BG637,"
							This racket length bag has two zippered, racket shaped sections suitable for nine squash rackets.

The bag features two wet-lined, vented pouches for shoes or wet clothing, wide openings of the main sections that allow for easy access to equipment and additional pockets built into the main sections for smaller valuables and accessories.

There are full backpack style shoulder straps with extra cushioning included with quick release clips. This bag is perfect for people who are looking for a medium sized bag that can organize a lot of rackets and other gear, and who appreciate the hands-free ease of a comfortable backpack.


Dimensions: 76 x 30 x 27cmMaterialEsdura 450D Ardura 210D RS 						",7603.83,9048.5577,BLACK KNIGHT Triple Thermo Squash Racket Bag,BLACK KNIGHT,,,http://products.activinstinct.com/y2012/m10/315580/88495473-n.jpg,http://assets.activinstinct.com/images/language/en/btn-click-to-zoom.gif,,
428462-WRZ842495,"
							This series of clothing and equipment celebrates 100 years of Wilson, paying homage a name that has shared in more winning moments than any other company in sports. 61 Majors. 48 Super Bowls. 20 Final Fours. 93 World Series Championships. And over 500 Grand Slams.

A brilliant bag for players of all abilities and ages; great for practice sessions and games alike. It also has a sleeve to carry two rackets.

Features:

Large compartment to hold shoes and apparel
Large accessory pockets to hold equipment
Small accessory pocket to hold valuables
Interior pocket to hold laptop or tablet						",7603.83,9048.5577,WILSON 100 Years Tour Small Backpack,WILSON,,,http://products.activinstinct.com/y2014/m05/428462/98092582-n.jpg,http://assets.activinstinct.com/images/language/en/btn-click-to-zoom.gif,,
230088-WRT967800,"
							The Wilson Hyper Hammer 145 Squash Racket features a Hyper Carbon construction that creates ultra stiffness in an ultra light frame for maximum manoeuvrability and power.

The Wilson Hammer system contributes to the ultra light construction creating a head heavy balance that is perfect for creating increased power to compliment the manoeuvrability.

Power Holes, uniquely designed oversized string holes allow for greater compression in the string bed, resulting in a significantly larger sweet spot which increases power even further and results in a much more forgiving frame.

Hyper Hammer technology, combined with the Hyper Carbon frame, produces a very stiff racket, contributing toward power with the added benefits of superb stability.

Features a 497 cm sq headsize, lightweight 145g frame and a head heavy balance.						",7603.83,9048.5577,WILSON Hyper Hammer 145 Squash Racket,WILSON,,,http://products.activinstinct.com/y2011/m06/230088/15973985-n.jpg,http://assets.activinstinct.com/images/language/en/btn-click-to-zoom.gif,,
358276-WRT905400,"
							Part of the 2013 Carbon Series, the CS Muscle is a great all round racket for the social to comp player.

Specification:

Headsize: 490cm2
Weight (unstrung): 170g
Balance (unstrung): 35cm
String pattern: 12 x 18						",7599.15,9042.9885,WILSON CS Muscle Squash Racket,WILSON,,,http://products.activinstinct.com/y2013/m05/358276/71317418-n.jpg,http://assets.activinstinct.com/images/language/en/btn-click-to-zoom.gif,,
